specimen_id,specimen_name,origin_id,mission_id,threat_level,acquisition_date,notes,description
S9039483,Hypnos Snail,O0563357,M5147208,9.2,2046-04-03,The snail secretes a powerful narcotic that can put humans into a deep sleep,"The Hypnos Snail is a dark, slimy creature approximately 40 centimeters in length. It produces a powerful narcotic that it can secrete from its skin when threatened. The narcotic induces a deep sleep state in most species, including humans. The snail is a herbivore, and its behavior is relatively docile until provoked. However, its ability to incapacitate potential threats makes it highly dangerous, and it poses a severe risk to humanoid life forms."
S1812590,Phantom Squid,O0563357,M5147208,8.4,2045-12-28,This squid can turn invisible and emit a high-pitched scream that can cause temporary deafness,"The Phantom Squid is a semi-transparent creature approximately 3 meters in length when fully grown. It has a unique ability to turn invisible at will, making it difficult to track. When threatened, the squid emits a piercing scream that can temporarily deafen those nearby. The creature is primarily a solitary hunter, and its predatory behavior poses a severe risk to humanoid life forms."
S1969165,Ferbalian,O6137297,M0642603,9.2,2067-11-02,Can emit a high-pitched scream deadly to ears,"The Ferbalian stands at two meters tall on its hind legs and possesses a lanky, humanoid body structure. It has elongated fingers with sharp claws and a mouth lined with razor-sharp teeth. Of greatest concern is its ability to emit a high-pitched scream capable of rendering a human incapacitated and even fatally damaging the ears. The Ferbalian is incredibly territorial and highly aggressive to those it perceives as a threat. It is recommended to avoid contact if possible and to equip sound-cancelling gear if physical confrontation is deemed unavoidable."
S0711704,Balicra,O6137297,M0642603,6.2,2066-04-19,Breathes toxic sludge,"The Balicra is a strange, yet intriguing creature that resembles a giant, crab-like insect. Its body is covered in a tough, metallic exoskeleton that is almost impervious to damage from blunt objects. The Balicra, however, is capable of spraying a caustic, toxic sludge from its mouth. F-SEA personnel should take precautions not to get caught in the spray. Though it may appear intimidating, the Balicra is not inherently hostile and should not pose an immediate threat to personnel."
S0792951,Zenithian Parasite,O6137297,M0695797,4.8,2047-02-15,Feeds off electromagnetic radiation,"This parasitic creature is about the size of a golf ball and is able to take on the appearance of any object or lifeform it latches onto. The Zenithian is unique in that it feeds off of electromagnetic radiation emitted by stars and other celestial bodies. It is not aggressive towards F-SEA personnel, but care should be taken with any exploration equipment that may be harboring the parasite."
S0075368,Salamanderoid,O6137297,M0695797,1.5,2047-12-30,Enjoys sunbathing,"This docile, lizard-like creature appears to serve no other purpose than to bask in the sun's rays. Its scaled skin is a deep, earthy orange color with splotches of ochre and umber. While it may startle at the sound of sudden movement, the Salamanderoid is content basking and has been observed to allow F-SEA personnel to come quite close to it without fleeing."
S9070767,Tentacle Beast,O0750939,M6558178,7.9,2075-09-01,The specimen seems to be able to regenerate tentacles when severed.,"This specimen is a hostile creature with large tentacles it uses to ensnare prey. The creature is extremely aggressive and indiscriminate when hunting for food. It has a tough, leathery skin which can sustain a great deal of damage. It has multiple rows of sharp teeth and emits a loud, high-pitched screech when threatened or hunting."
S1996624,Anomalous Crystal,O0750939,M6558178,9.8,2074-12-02,"The crystal emits a strange, otherworldly energy that interferes with electronic equipment.","This specimen is a large, anomalous crystal that seems to possess strange and unpredictable powers. It is highly dangerous and should be approached with extreme caution. The crystal emits a bright, pulsating light and seems to warp the space around it. It has been known to cause headaches, dizziness, and other adverse effects on nearby personnel."
S0557586,Glowing Spore Cloud,O0750939,M1660209,2.5,2062-02-28,"The specimen emits a faint, soothing hum.","This specimen is a cloud of glowing spores that float through the air. It is relatively harmless, though may cause respiratory distress to certain individuals. The spores emit a pleasant, calming aroma which can cause drowsiness in larger quantities."
S8053258,Crystaline Lizard,O0750939,M9915390,5.2,2055-12-18,The specimen seems to be able to refract light through its body.,"This specimen is a small lizard-like creature with crystalline scales. It is relatively docile, but can be aggressive if provoked. The creature is able to jump great distances due to its low weight and strong legs. Its scales are razor sharp and the creature can use them as a defensive mechanism when threatened."
S0664174,Hyper-Aggressive Thallus,O3210149,M4512143,8.2,2058-07-22,Releases a toxic cloud when threatened,"This plant-like organism has a thallus body and uses photosynthesis to produce energy. It is highly aggressive and attacks any nearby creatures, using tendrils to grapple and suffocate them. It releases a toxic cloud when threatened, which can cause hallucinations and sudden loss of consciousness. It is deemed too dangerous for normal containment and requires a specially designed facility."
S1300511,Electric Jellyfish,O3210149,M4512143,5.8,2058-05-03,Can emit electrical discharges up to 20 volts,This translucent jellyfish-like creature has a bell-shaped body and long tentacles. It is attracted to electric fields and can generate electrical discharges up to 20 volts. It can use these discharges to stun its prey or defend against predators. It is considered volatile and requires controlled access and monitoring.
S3621355,Toxic Gas Cloud,O3210149,M4512143,9.9,2058-09-01,Highly corrosive and can disintigrate most materials.,"This gaseous lifeform is a cloud of corrosive gas that can disintegrate most materials on contact. It can move quickly and unpredictably, making it difficult to contain. It is considered highly dangerous and requires extensive security measures to prevent escape or interaction."
S1955510,Amorphous Shapeshifter,O3210149,M8671293,9.5,2070-06-01,"Can assume the shape of any object or organism it has observed, including human beings","This highly intelligent lifeform has amorphous, gelatinous body with no distinct features. It can alter its shape and mimic any organism or object it has encountered. It can use this ability to infiltrate human societies and gain access to sensitive information. It is considered extremely hostile and poses an extreme threat to containment."
S1196316,Crystal Spider,O3210149,M8671293,3.7,2069-03-14,Can camoflauge with its surroundings using its crystalline body,"This spider-like creature has a crystalline exoskeleton that refracts light, allowing it to blend in with its surroundings. It is not very aggressive and feeds on small insects. It is considered safe and can be freely accessed within designated areas."
S0091723,Sonic Screecher,O3210149,M8671293,6.4,2069-01-06,Capable of emitting sonic waves that can cause temporary deafness and dizziness,"This bird-like creature has a wingspan of approximately 2 meters, and feathers that are a bluish-green iridescent color. It feeds mostly on small insects, and can emit a loud, piercing screech that can cause temporary deafness and dizziness in those within close proximity. It is considered hazardous and must be constantly monitored by trained personnel."
S2552592,Jelly Eel,O7623081,M2986704,7.9,2067-05-01,Can extend its tentacles over a distance equivalent to 5 times its body length.,"It is a large, semi-transparent creature with tendrils that can reach a great distance. The creature is attracted to electricity and is capable of generating an electrical charge of up to 50 volts."
S8917905,Volatile Gas Blob,O7623081,M2986704,6.2,2066-06-10,Explosive when exposed to extreme heat.,This gaseous lifeform appears as a yellow blob with a fiery orange center. It is highly volatile and can combust with even the slightest exposure to heat. The gaseous composition of the specimen is currently unknown.
S4150409,Thunderbolt Kraken,O7623081,M2986704,10,2067-02-20,Can summon bolts of lightning and produce EMP waves.,"The Thunderbolt Kraken is a massive, cephalopod-like creature capable of summoning bolts of lightning from the sky and producing EMP waves that can fry electronic equipment within a hundred-yard radius. It uses its powerful tentacles to crush and manipulate its prey and can breathe underwater using a specialized gill system. The Thunderbolt Kraken is a highly dangerous creature that requires maximum security containment."
S2285354,Crystal Beetle,O7623081,M2612566,2.6,2071-01-20,Can hide itself by appearing as a crystal when dormant.,"This armored beetle has a hard, crystalline shell that reflects light in a beautiful array of colors. When threatened, this beetle can quickly burrow into the ground, but when dormant, it appears as an ordinary crystal. The beetle is not known to be very aggressive, but has a powerful jaw capable of crushing rocks."